LID-00268,,Access 2 Mobility,12/29/2025,"Met with the manager Mike and explained our process. They currently haul the scrap off themselves and typically take about 5,000 pounds every 3 months or so. He was very interested in our service and asked for me to send him information regarding the process, so he can get with the higher ups and get something put in place.",Initial Contact,Outreach,Interested (Warm),01/28/2026,42,-12,Initial Contact,General follow,Kyle Buzbee,FALSE,Visit,FALSE,None
LID-00269,CID-JOE105,Joe Hudsons Collision Center,12/29/2025,"The manager was called home for an emergency, but was told to come back tomorrow around 9am to speak to him.",Initial Contact,Outreach,Interested (Warm),01/28/2026,42,-12,Initial Contact,General follow,Kyle Buzbee,TRUE,Visit,FALSE,None
LID-00270,CID-AND105,Anderson Automotive,12/29/2025,"The owner/manager will be in and out this week. They currently have a guy who picks up their scrap once a month, but the service manager was unsure about where they take it, amount of pounds he takes, and the payout structure. He said to check back in next week because I would have a better chance of talking to the manager or owner.",Initial Contact,Outreach,Interested (Warm),01/28/2026,42,-12,Initial Contact,General follow,Kyle Buzbee,TRUE,Visit,FALSE,None
LID-00271,CID-DEA103,Dealers Collision,12/29/2025,"Spoke to the manager and he showed me what all they have acquired since September, and he said they haul it themselves. But they have gotten new management since then, so it has been just building up and is just sitting in a corner in the lot and it does not look presentable. He said to give him a couple of days and to give him time to speak with the owner and see if we can get something worked out.",Initial Contact,Outreach,Interested (Warm),01/28/2026,42,-12,Initial Contact,General follow,Kyle Buzbee,TRUE,Visit,FALSE,None
LID-00272,CID-CAL104,Callibur Collision,12/29/2025,"Spoke to the receptionist and she had said that the manager would be back in tomorrow, so I plan on visiting first thing in the morning that way I can visit Joe Hudson and Callibur Collision",Initial Contact,Outreach,Interested (Warm),01/28/2026,42,-12,Initial Contact,General follow,Kyle Buzbee,TRUE,Visit,FALSE,None
LID-00273,CID-WCB101,Wc Brakes and Service Parts,12/29/2025,They also take their scrap metal to Huntwell and will be interested in a roll off container once they move locations,Initial Contact,Outreach,Interested (Warm),01/28/2026,42,-12,Initial Contact,General follow,Kyle Buzbee,TRUE,Visit,FALSE,None
LID-00274,CID-HAB101,Habitat for Humanity,12/26/2025,"Spoke to the assistant manager, who is not really able to make any decision about what they do with their scrap metal. He showed me what their facility looks like and told me that they only take a trailer full of scrap every 2 months of so, but take it to Tyler Iron. I told him that I could pay more than what Tyler Iron is paying if he takes it to Madfos and he was interested. Said he would put my card on the administrators desk and they will get back to me sometime in the next week or two",Interested (Warm),Nurture,Interested (Warm),01/09/2026,45,-31,Interested (Warm),Send pricing,Kyle Buzbee,TRUE,Visit,FALSE,None
LID-00275,CID-FAI102,Faithco Enterprises Plumbing HVAC Electric,12/26/2025,Called and spoke with someone and was told that they are not familiar with me stopping by but will let the owner know that I had tried to reach out because they are out of the office until next week,Interested (Warm),Nurture,Interested (Warm),01/09/2026,45,-31,Interested (Warm),Send pricing,Kyle Buzbee,TRUE,Phone,FALSE,None
LID-00276,CID-MIL105,Miller Electric,12/26/2025,Tried to visit but the door was locked. I didnt see any cars there so I assume they are off until next week,Initial Contact,Outreach,Interested (Warm),01/25/2026,45,-15,Initial Contact,General follow,Kyle Buzbee,TRUE,Visit,FALSE,None
LID-00277,CID-BUF101,Buford Satellite Systems LP,12/26/2025,Tried to visit but there was no one at their office,Initial Contact,Outreach,Interested (Warm),01/25/2026,45,-15,Initial Contact,General follow,Kyle Buzbee,TRUE,Visit,FALSE,None
LID-00278,CID-PAT102,Patriot Electric,12/26/2025,No one was at their office,Initial Contact,Outreach,Interested (Warm),01/25/2026,45,-15,Initial Contact,General follow,Kyle Buzbee,TRUE,Visit,FALSE,None
LID-00279,CID-TYL125,Tyler Heating and Air Conditioning,12/26/2025,Was told that they didnt have space for a roll off container so I gave them my card and let them know that if they ever take their scrap somewhere then it needs to be taken to Madfos because I can pay top dollar for it.,Initial Contact,Outreach,Interested (Warm),01/25/2026,45,-15,Initial Contact,General follow,Kyle Buzbee,TRUE,Visit,FALSE,None
LID-00274,CID-HAB101,Habitat for Humanity,12/26/2025,"Spoke to the assistant manager, who is not really able to make any decision about what they do with their scrap metal. He showed me what their facility looks like and told me that they only take a trailer full of scrap every 2 months of so, but take it to Tyler Iron. I told him that I could pay more than what Tyler Iron is paying if he takes it to Madfos and he was interested. Said he would put my card on the administrators desk and they will get back to me sometime in the next week or two",Interested (Warm),Nurture,Interested (Warm),01/09/2026,45,-31,Interested (Warm),Send pricing,Kyle Buzbee,TRUE,Visit,FALSE,None
LID-00275,CID-FAI102,Faithco Enterprises Plumbing HVAC Electric,12/26/2025,Called and spoke with someone and was told that they are not familiar with me stopping by but will let the owner know that I had tried to reach out because they are out of the office until next week,Interested (Warm),Nurture,Interested (Warm),01/09/2026,45,-31,Interested (Warm),Send pricing,Kyle Buzbee,TRUE,Phone,FALSE,None
LID-00276,CID-MIL105,Miller Electric,12/26/2025,Tried to visit but the door was locked. I didnt see any cars there so I assume they are off until next week,Initial Contact,Outreach,Interested (Warm),01/25/2026,45,-15,Initial Contact,General follow,Kyle Buzbee,TRUE,Visit,FALSE,None
LID-00277,CID-BUF101,Buford Satellite Systems LP,12/26/2025,Tried to visit but there was no one at their office,Initial Contact,Outreach,Interested (Warm),01/25/2026,45,-15,Initial Contact,General follow,Kyle Buzbee,TRUE,Visit,FALSE,None
LID-00278,CID-PAT102,Patriot Electric,12/26/2025,No one was at their office,Initial Contact,Outreach,Interested (Warm),01/25/2026,45,-15,Initial Contact,General follow,Kyle Buzbee,TRUE,Visit,FALSE,None
LID-00279,CID-TYL125,Tyler Heating and Air Conditioning,12/26/2025,Was told that they didnt have space for a roll off container so I gave them my card and let them know that if they ever take their scrap somewhere then it needs to be taken to Madfos because I can pay top dollar for it.,Initial Contact,Outreach,Interested (Warm),01/25/2026,45,-15,Initial Contact,General follow,Kyle Buzbee,TRUE,Visit,FALSE,None
LID-00281,CID-TYL129,Tyler Rv,12/23/2025,"Brad Shaw took his metal to Madfos and was given special pricing. I would consider this a win because if I hadn't stopped and talked to him then he would have taken to where he normally does (Tyler Iron). Erick is going to send me how much his material weighed. He had short iron, aluminum, breakage, copper #1 & #2, Al/Cu Reefers, ICW, motors, and compressors.",Account Won,Won,Active,12/24/2025,48,-47,Account Won,Onboard Account,Kyle Buzbee,TRUE,Phone,FALSE,None
LID-00282,CID-LEW102,Lews Welding,12/23/2025,"Account Won.
Corey and I worked out prices and they are as follows:
Al 6061 extrusion: $1.02 / lb
Al 3003: $1 20 / lb
Al 5052: $1.20 / lb
Stainless Steel: $0.28 / lb
Short Iron: $9.00 / 100lbs . The one thing that was holding him back at first was him saying how AIM i literally a mile from where they are and it doesn't cost $50 to take the metal over there, so I waived the $50 roll off fee because he already has an entire load of tin/short iron and another load of aluminum ready to be loaded and dumped",Account Won,Won,Active,12/24/2025,48,-47,Account Won,Onboard Account,Kyle Buzbee,TRUE,Visit,FALSE,None
LID-00283,CID-NOJ101,No Junk,12/23/2025,"Account Won

Corey and I agreed to pay $0.50 over base price for this account. Since June they have done 40k in scrap metal (the owner added up all of his receipts) so I think this account will turn out to be pretty good. They are needing a 30 yeard container and will be bringing scrap in on their trailer on a consistent basis, as well as needing live loads done as well.",Account Won,Won,Active,12/24/2025,48,-47,Account Won,Onboard Account,Kyle Buzbee,TRUE,Visit,FALSE,None
LID-00280,CID-903102,903 Plumbing,12/23/2025,Spoke to a guy who had only been there a couple of days because the other two could not speak English. I will have to follow up and speak with the owner because the guy did not know anything about what was going on,Initial Contact,Outreach,Interested (Warm),01/22/2026,48,-18,Initial Contact,General follow,Kyle Buzbee,TRUE,Visit,FALSE,None
LID-00284,CID-CWO102,C Woods,12/23/2025,Talked to the receptionist and she said that I had just missed the person I needed to talk to so I will go back next week to see if I can talk to someone who can make decisions.,Initial Contact,Outreach,Interested (Warm),01/22/2026,48,-18,Initial Contact,General follow,Kyle Buzbee,TRUE,Visit,FALSE,None
LID-00280,CID-903102,903 Plumbing,12/23/2025,Spoke to a guy who had only been there a couple of days because the other two could not speak English. I will have to follow up and speak with the owner because the guy did not know anything about what was going on,Initial Contact,Outreach,Interested (Warm),01/22/2026,48,-18,Initial Contact,General follow,Kyle Buzbee,TRUE,Visit,FALSE,None
LID-00284,CID-CWO102,C Woods,12/23/2025,Talked to the receptionist and she said that I had just missed the person I needed to talk to so I will go back next week to see if I can talk to someone who can make decisions.,Initial Contact,Outreach,Interested (Warm),01/22/2026,48,-18,Initial Contact,General follow,Kyle Buzbee,TRUE,Visit,FALSE,None
LID-00285,CID-HAU101,Hauling It Off or On,12/22/2025,Spoke to Eldridge Hayter and confirmed his need for a roll off container for his junk removal business. He said he is ready when we are.,Account Won,Won,Active,12/23/2025,49,-48,Account Won,Onboard Account,Kyle Buzbee,TRUE,Visit,FALSE,None
LID-00286,CID-JOE101,Joe Hudson,12/22/2025,Spoke to receptionist. She said they have someone but pick up a trailer load 2x/week. Potential decent account. Manager was not there to give contact info.,Initial Contact,Outreach,Interested (Warm),01/21/2026,49,-19,Initial Contact,General follow,Kyle Buzbee,TRUE,Visit,FALSE,None
LID-00287,CID-ONE124,One Ten Welding,12/22/2025,"Sent Corey the owner's ""something in writing"" conditions draft that Tyler Iron currently provides. Waiting for confirmation to send.",Interested (Warm),Nurture,Interested (Warm),01/05/2026,49,-35,Interested (Warm),Send pricing,Kyle Buzbee,TRUE,Visit,FALSE,None
LID-00288,CID-ROZ101,Rozells,12/22/2025,"Spoke to owner. They don't produce much, usually take to Tyler Iron. Told him we offer better service/pricing. He said they would ""try us out"".",Interested (Warm),Nurture,Interested (Warm),01/05/2026,49,-35,Interested (Warm),Send pricing,Kyle Buzbee,TRUE,Visit,FALSE,None
LID-00289,CID-BIZ101,Bizzy Bees Junk Removal,12/22/2025,Spoke to owner. Scrap ~3x a year. Discussed pricing and making it worth his while. He said he would take me up on that.,Interested (Warm),Nurture,Interested (Warm),01/05/2026,49,-35,Interested (Warm),Send pricing,Kyle Buzbee,TRUE,Visit,FALSE,None
LID-00290,CID-SAW102,Sawyer Metals,12/22/2025,"Currently use Tyler Iron and are happy. Manager not in, couldn't get volume indication.",Initial Contact,Outreach,Interested (Warm),01/21/2026,49,-19,Initial Contact,General follow,Kyle Buzbee,TRUE,Visit,FALSE,None
LID-00291,CID-STA112,Stainless Steel Fabricators,12/22/2025,Spoke to office manager. Uses Tyler Iron. Owner in and out a lot. Visual inspection shows good amount of stainless steel.,Initial Contact,Outreach,Interested (Warm),01/21/2026,49,-19,Initial Contact,General follow,Kyle Buzbee,TRUE,Visit,FALSE,None
LID-00292,CID-ROS108,Rose City Fab,12/22/2025,Did not see anyone at their facility.,Initial Contact,Outreach,Interested (Warm),01/21/2026,49,-19,Initial Contact,General follow,Kyle Buzbee,TRUE,Visit,FALSE,None
LID-00293,CID-CAT105,Cates Machinery,12/22/2025,"Owner not in. Spoke to receptionist, she didn't know pricing/volume info. Need to reach owner.",Initial Contact,Outreach,Interested (Warm),01/21/2026,49,-19,Initial Contact,General follow,Kyle Buzbee,TRUE,Visit,FALSE,None
LID-00286,CID-JOE101,Joe Hudson,12/22/2025,Spoke to receptionist. She said they have someone but pick up a trailer load 2x/week. Potential decent account. Manager was not there to give contact info.,Initial Contact,Outreach,Interested (Warm),01/21/2026,49,-19,Initial Contact,General follow,Kyle Buzbee,TRUE,Visit,FALSE,None
LID-00287,CID-ONE124,One Ten Welding,12/22/2025,"Sent Corey the owner's ""something in writing"" conditions draft that Tyler Iron currently provides. Waiting for confirmation to send.",Interested (Warm),Nurture,Interested (Warm),01/05/2026,49,-35,Interested (Warm),Send pricing,Kyle Buzbee,TRUE,Visit,FALSE,None
LID-00288,CID-ROZ101,Rozells,12/22/2025,"Spoke to owner. They don't produce much, usually take to Tyler Iron. Told him we offer better service/pricing. He said they would ""try us out"".",Interested (Warm),Nurture,Interested (Warm),01/05/2026,49,-35,Interested (Warm),Send pricing,Kyle Buzbee,TRUE,Visit,FALSE,None
LID-00289,CID-BIZ101,Bizzy Bees Junk Removal,12/22/2025,Spoke to owner. Scrap ~3x a year. Discussed pricing and making it worth his while. He said he would take me up on that.,Interested (Warm),Nurture,Interested (Warm),01/05/2026,49,-35,Interested (Warm),Send pricing,Kyle Buzbee,TRUE,Visit,FALSE,None
LID-00290,CID-SAW102,Sawyer Metals,12/22/2025,"Currently use Tyler Iron and are happy. Manager not in, couldn't get volume indication.",Initial Contact,Outreach,Interested (Warm),01/21/2026,49,-19,Initial Contact,General follow,Kyle Buzbee,TRUE,Visit,FALSE,None
LID-00291,CID-STA112,Stainless Steel Fabricators,12/22/2025,Spoke to office manager. Uses Tyler Iron. Owner in and out a lot. Visual inspection shows good amount of stainless steel.,Initial Contact,Outreach,Interested (Warm),01/21/2026,49,-19,Initial Contact,General follow,Kyle Buzbee,TRUE,Visit,FALSE,None
LID-00292,CID-ROS108,Rose City Fab,12/22/2025,Did not see anyone at their facility.,Initial Contact,Outreach,Interested (Warm),01/21/2026,49,-19,Initial Contact,General follow,Kyle Buzbee,TRUE,Visit,FALSE,None
LID-00293,CID-CAT105,Cates Machinery,12/22/2025,"Owner not in. Spoke to receptionist, she didn't know pricing/volume info. Need to reach owner.",Initial Contact,Outreach,Interested (Warm),01/21/2026,49,-19,Initial Contact,General follow,Kyle Buzbee,TRUE,Visit,FALSE,None
LID-00295,CID-CAL120,Caliber Collision,12/12/2025,"Spoke to the general manager Samantha Garland and they currently have their own roll-off container with corporate. I let her know that even if we cannot put a roll-off container at their business, I will buy the metal at top dollar for them to dump it at Madfos. She gave me her card and told me to email her the prices I can pay for tin and aluminum. She thinks she is currently being paid $0.30-$0.40 /lb but is not entirely sure. The max Madfos is paying is $0.58/lb so I am going to offer them the max because they do a lot of busniess and I think it would be a steady account in terms of volume",Interested (Warm),Nurture,Interested (Warm),12/26/2025,59,-45,Interested (Warm),Send pricing,Kyle Buzbee,TRUE,Visit,FALSE,None
LID-00296,CID-MCC102,Mccoys Plumbing,12/12/2025,The receptionist told me that I had just missed Mr. McCoy and that a good time to come back would be early in the morning. I put him on my schedule to visit him on Monday first thing in the morning,Interested (Warm),Nurture,Interested (Warm),12/26/2025,59,-45,Interested (Warm),Send pricing,Kyle Buzbee,TRUE,Visit,FALSE,None
LID-00297,CID-EXP107,Express Engines,12/12/2025,"Spoke to the manager there for a while and viewed their property. They currently haul their scrap with a trailer to Tyler Iron. He currently cannot make any decisions until the owner Randy reviews it, but this is a very wam lead because they seemed very interested.",Initial Contact,Outreach,Interested (Warm),01/11/2026,59,-29,Initial Contact,General follow,Kyle Buzbee,TRUE,Visit,FALSE,None
LID-00298,CID-CAL120,Caliber Collision,12/12/2025,spoke to a guy at the front desk and let me know that corporate is the one who deals with their handling of scrap. I let him know that I talked to the other location and that I could offer top dollar for him to dump the scrap at Madfos. He took down my information and card and said he would give it to his manager and they would reach out.,Initial Contact,Outreach,Interested (Warm),01/11/2026,59,-29,Initial Contact,General follow,Kyle Buzbee,TRUE,Visit,FALSE,None
LID-00299,CID-AEG101,Aegis Therapy,12/12/2025,"Spoke to someone who is wanting to get rid of a lot of wheelchairs for a retirement home as they are needing to replace the old ones. I told him that I would buy them, but he might not get as much money as he wants for them. I gave him my card, and he is going to reach out as soon as he makes a decision.",Initial Contact,Outreach,Interested (Warm),01/11/2026,59,-29,Initial Contact,General follow,Kyle Buzbee,TRUE,Visit,FALSE,None
LID-00300,CID-MCD101,Mcdonalds,12/12/2025,My brother in law has a warehouse that is full of old stainless steel kitchenware from McDonald's and is wanting to do a major cleanup and will be needing a roll-off soon. He doesnt know the exact date yet,Initial Contact,Outreach,Interested (Warm),01/11/2026,59,-29,Initial Contact,General follow,Kyle Buzbee,TRUE,Visit,FALSE,None
LID-00294,CID-ROT106,Rotorooters,12/12/2025,"Spoke to the owner mike and he said that he really didn't generate enough scrap to have a roll off container. specifically said ""I am not interested in a roll-off container"" but he did seem interested for whenever he has to haul off his scrap about giving me a call and taking it to Madfos",Not Interested,Lost,Disqualified,06/10/2026,59,121,Not Interested,Send pricing,Kyle Buzbee,TRUE,Visit,FALSE,None
LID-00295,CID-CAL120,Caliber Collision,12/12/2025,"Spoke to the general manager Samantha Garland and they currently have their own roll-off container with corporate. I let her know that even if we cannot put a roll-off container at their business, I will buy the metal at top dollar for them to dump it at Madfos. She gave me her card and told me to email her the prices I can pay for tin and aluminum. She thinks she is currently being paid $0.30-$0.40 /lb but is not entirely sure. The max Madfos is paying is $0.58/lb so I am going to offer them the max because they do a lot of busniess and I think it would be a steady account in terms of volume",Interested (Warm),Nurture,Interested (Warm),12/26/2025,59,-45,Interested (Warm),Send pricing,Kyle Buzbee,TRUE,Visit,FALSE,None
LID-00296,CID-MCC102,Mccoys Plumbing,12/12/2025,The receptionist told me that I had just missed Mr. McCoy and that a good time to come back would be early in the morning. I put him on my schedule to visit him on Monday first thing in the morning,Interested (Warm),Nurture,Interested (Warm),12/26/2025,59,-45,Interested (Warm),Send pricing,Kyle Buzbee,TRUE,Visit,FALSE,None
LID-00297,CID-EXP107,Express Engines,12/12/2025,"Spoke to the manager there for a while and viewed their property. They currently haul their scrap with a trailer to Tyler Iron. He currently cannot make any decisions until the owner Randy reviews it, but this is a very wam lead because they seemed very interested.",Initial Contact,Outreach,Interested (Warm),01/11/2026,59,-29,Initial Contact,General follow,Kyle Buzbee,TRUE,Visit,FALSE,None
LID-00298,CID-CAL120,Caliber Collision,12/12/2025,spoke to a guy at the front desk and let me know that corporate is the one who deals with their handling of scrap. I let him know that I talked to the other location and that I could offer top dollar for him to dump the scrap at Madfos. He took down my information and card and said he would give it to his manager and they would reach out.,Initial Contact,Outreach,Interested (Warm),01/11/2026,59,-29,Initial Contact,General follow,Kyle Buzbee,TRUE,Visit,FALSE,None
LID-00299,CID-AEG101,Aegis Therapy,12/12/2025,"Spoke to someone who is wanting to get rid of a lot of wheelchairs for a retirement home as they are needing to replace the old ones. I told him that I would buy them, but he might not get as much money as he wants for them. I gave him my card, and he is going to reach out as soon as he makes a decision.",Initial Contact,Outreach,Interested (Warm),01/11/2026,59,-29,Initial Contact,General follow,Kyle Buzbee,TRUE,Visit,FALSE,None
LID-00300,CID-MCD101,Mcdonalds,12/12/2025,My brother in law has a warehouse that is full of old stainless steel kitchenware from McDonald's and is wanting to do a major cleanup and will be needing a roll-off soon. He doesnt know the exact date yet,Initial Contact,Outreach,Interested (Warm),01/11/2026,59,-29,Initial Contact,General follow,Kyle Buzbee,TRUE,Visit,FALSE,None
LID-00301,CID-TYL126,Tyler Industrial Supply,12/11/2025,"Spoke with the manager and looked around at what type of area he would want the roll-off container to be placed in. He currently has several large boxes of short iron, several 20ft stainless steel pipes that are about a 8 inches wide, 20-30 ft slong iron pipes, and aluminum pipes. He told me to come back about mid-January because he is not exactly sure what he wants to do with his inventory. I put a calendar event for January 14th so we can get this account rolling. He seems very interested as i addressed any and all questions he had regarding the separation of metal, length of pipes, and container size and location so it is not in the way.",Interested (Warm),Nurture,Interested (Warm),12/25/2025,60,-46,Interested (Warm),Send pricing,Kyle Buzbee,TRUE,Visit,FALSE,None
LID-00302,CID-HYD101,Hydro Chem,12/11/2025,They did not feel as if they accumulated enough scrap metal to warrant a roll off container. I let them know that I will buy any volume of metal so if they do come across some to give me a call and take it over to Madfos so I can get them the best price.,Disqualified,Lost,Disqualified,12/11/2025,60,-60,Disqualified,Check periodic,Kyle Buzbee,FALSE,Visit,FALSE,None
LID-00301,CID-TYL126,Tyler Industrial Supply,12/11/2025,"Spoke with the manager and looked around at what type of area he would want the roll-off container to be placed in. He currently has several large boxes of short iron, several 20ft stainless steel pipes that are about a 8 inches wide, 20-30 ft slong iron pipes, and aluminum pipes. He told me to come back about mid-January because he is not exactly sure what he wants to do with his inventory. I put a calendar event for January 14th so we can get this account rolling. He seems very interested as i addressed any and all questions he had regarding the separation of metal, length of pipes, and container size and location so it is not in the way.",Interested (Warm),Nurture,Interested (Warm),12/25/2025,60,-46,Interested (Warm),Send pricing,Kyle Buzbee,TRUE,Visit,FALSE,None
LID-00304,CID-TYL141,Tyler Rv Center,12/10/2025,"Spoke to Mr. Shaw for quite a while because he knows Mark and Andy and Dylan fairly well. He told me that he forgets about Madfos because he doesn't see very much action every time he passes by it. He is currently doing a large clean up because he is selling his business and has a fair amount of aluminum, short iron, motors, copper #1 & #2, ICW, Al/Cu radiators and compressors that he is trying to sell. I told him that I would pay him top dollar for it, so I need to get with Corey on what prices I can offer him. Right now Tyler Iron is paying $8.50/100lb and will check with Dylan on NF prices",Account Won,Won,Active,12/11/2025,61,-60,Account Won,Onboard Account,Kyle Buzbee,FALSE,Visit,FALSE,None
LID-00308,CID-PED101,Pedros Paint and Body,12/10/2025,"Spoke to Pedro, and he would like a 20-yard container at the earliest next Wednesday. It is an autobody shop so he will need his metal separated.",Account Won,Won,Active,12/11/2025,61,-60,Account Won,Onboard Account,Kyle Buzbee,TRUE,Visit,FALSE,None
LID-00309,CID-TYL129,Tyler Rv,12/10/2025,Called Mr. Shaw back regarding the prices that we can pay for his metal and his receptionist told me to email her the prices so she can give it to him. I sent him an email with the prices and told her to tell him to give me a call or text as soon as he looks it over.,Account Won,Won,Active,12/11/2025,61,-60,Account Won,Onboard Account,Kyle Buzbee,TRUE,Visit,FALSE,None
LID-00303,CID-AME116,Ameco,12/10/2025,"I was instructed that I needed to speak to Tommy Morrison because he seems to be the only one who knows about their roll off container. He is currently sick and most likely will not be at the office the rest of the week, so I will schedule a follow up for next week.",Interested (Warm),Nurture,Interested (Warm),12/24/2025,61,-47,Interested (Warm),Send pricing,Kyle Buzbee,TRUE,Visit,FALSE,None
