LID-00111,CID-RYA102,Ryan Heimer,01/28/2026,"Spoke to an electrician out of Longview, and he said he might need a roll-off, but if he doesn't, he will start taking his scrap to Madfos.",Initial Contact,Outreach,Interested (Warm),02/27/2026,12,18,Initial Contact,General follow,Kyle Buzbee,TRUE,Visit,FALSE,None
LID-00113,CID-AUT172,Auto Electrical Service,01/23/2026,"Could not get ahold of anyone, and am unsure if they are a viable company to pursue, so I will follow up on Monday, if the ice storm hasn't gotten to me by then",No Answer,Outreach,Cold,01/26/2026,17,-14,No Answer,Try again,Kyle Buzbee,FALSE,Visit,FALSE,None
LID-00112,CID-AUT167,Auto Parts Warehouse,01/23/2026,"I am not sure who they use, but the office assistant gave me the owner's number, and I called him, and he was driving a truck and said he would call me back later, and I never got a call back. I will follow up first thing Monday morning.",Interested (Warm),Nurture,Interested (Warm),02/06/2026,17,-3,Interested (Warm),Send pricing,Kyle Buzbee,TRUE,Visit,FALSE,None
LID-00114,CID-HOL103,Holt,01/23/2026,"Met with Serena and they currently use Athens Iron and Metal and she was not sure what they were paying, but she said she had gotten some time, and then she would pull it up and give me a call back later in the day. I never got a call from her so if I haven't slipped and sufferered a mild to severe concussion by Monday from the ice then I will swing by there first thing in the morning.",Interested (Warm),Nurture,Interested (Warm),02/06/2026,17,-3,Interested (Warm),Send pricing,Kyle Buzbee,TRUE,Visit,FALSE,None
LID-00115,CID-SAW103,Sawyers Metals,01/23/2026,"I wasn't able to speak to anyone who could talk to me about the roll off because they had already gone home, so Monday, if frostbite hasn't gotten the best of my fingers and toes, I will stop by and try and get in contact with a manager.",Follow-Up,Nurture,Interested (Warm),02/06/2026,17,-3,Follow-Up,General follow,Kyle Buzbee,TRUE,Visit,FALSE,None
LID-00116,CID-THA101,That Window Guy,01/23/2026,The guy said that he would let the owner know that I called so I will keep trying to follow up until they tell me to stop contacting them.,Follow-Up,Nurture,Interested (Warm),02/06/2026,17,-3,Follow-Up,General follow,Kyle Buzbee,TRUE,Phone,FALSE,None
LID-00112,CID-AUT167,Auto Parts Warehouse,01/23/2026,"I am not sure who they use, but the office assistant gave me the owner's number, and I called him, and he was driving a truck and said he would call me back later, and I never got a call back. I will follow up first thing Monday morning.",Interested (Warm),Nurture,Interested (Warm),02/06/2026,17,-3,Interested (Warm),Send pricing,Kyle Buzbee,TRUE,Visit,FALSE,None
LID-00114,CID-HOL103,Holt,01/23/2026,"Met with Serena and they currently use Athens Iron and Metal and she was not sure what they were paying, but she said she had gotten some time, and then she would pull it up and give me a call back later in the day. I never got a call from her so if I haven't slipped and sufferered a mild to severe concussion by Monday from the ice then I will swing by there first thing in the morning.",Interested (Warm),Nurture,Interested (Warm),02/06/2026,17,-3,Interested (Warm),Send pricing,Kyle Buzbee,TRUE,Visit,FALSE,None
LID-00115,CID-SAW103,Sawyers Metals,01/23/2026,"I wasn't able to speak to anyone who could talk to me about the roll off because they had already gone home, so Monday, if frostbite hasn't gotten the best of my fingers and toes, I will stop by and try and get in contact with a manager.",Follow-Up,Nurture,Interested (Warm),02/06/2026,17,-3,Follow-Up,General follow,Kyle Buzbee,TRUE,Visit,FALSE,None
LID-00116,CID-THA101,That Window Guy,01/23/2026,The guy said that he would let the owner know that I called so I will keep trying to follow up until they tell me to stop contacting them.,Follow-Up,Nurture,Interested (Warm),02/06/2026,17,-3,Follow-Up,General follow,Kyle Buzbee,TRUE,Phone,FALSE,None
LID-00117,CID-BLU101,Blue Goose Customs Fabrication,01/22/2026,I called and left a voicemail wanting to discuss their current prices that they are getting for their metal.,No Answer,Outreach,Cold,01/25/2026,18,-15,No Answer,Try again,Kyle Buzbee,FALSE,Visit,FALSE,None
LID-00121,CID-ALL111,All Star Fabrication,01/22/2026,"Tried going by but the door is locked. Spoke to the manager and he didn’t seem interested / did not have the space for a roll off container. This will have to be an account I touch every month or so, but I really don’t think they produce much scrap metal.",Not Interested,Lost,Disqualified,07/21/2026,18,162,Not Interested,Send pricing,Kyle Buzbee,FALSE,Visit,FALSE,None
LID-00123,CID-RED108,Reds Auto Parts,01/22/2026,"Tried reaching back out to Mike because he is sitting on a ton of scrap at his property, but I still cannot get ahold of him",No Answer,Outreach,Cold,01/25/2026,18,-15,No Answer,Try again,Kyle Buzbee,FALSE,Visit,FALSE,None
LID-00118,CID-RUS102,Rusk County Op,01/22/2026,"Spoke to Matt who said that they switched because a local guy who has about a dozen roll-off containers approached them and said that he would split the money made from the metal 50/50 with them. Matt does not even know the prices the local guy is getting for the metal and has not even seen a single ticket from us or the local guy. He said it has currently been working out great, but it has been for a very short period of time so he cannot say it will continue to work out. He asked me to send him an email @ matt@rcelectric.org with our prices and after the storm, will get with his team and look it over and get back with me.",Follow-Up,Nurture,Interested (Warm),02/05/2026,18,-4,Follow-Up,General follow,Kyle Buzbee,TRUE,Phone,FALSE,None
LID-00119,CID-DEA103,Dealers Collision,01/22/2026,Spoke to the front desk guy and he said he was going to get the with manager who I initially met with and said he would me give a call back.,Interested (Warm),Nurture,Interested (Warm),02/05/2026,18,-4,Interested (Warm),Send pricing,Kyle Buzbee,TRUE,Visit,FALSE,None
LID-00120,CID-ACC,Access 2 Mobility,01/22/2026,"Left a voicemail since the manager was with a customer, but I am going to try and call back a little later if I don’t hear anything.",Interested (Warm),Nurture,Interested (Warm),02/05/2026,18,-4,Interested (Warm),Send pricing,Kyle Buzbee,FALSE,Visit,FALSE,None
LID-00122,CID-DGI102,Dgi,01/22/2026,"Spoke to the owner and he is wanting me to send him prices for 5052 aluminum because he currently takes it to Dallas. He generates about 2,000 pounds of aluminum every 6-8 weeks.",Interested (Warm),Nurture,Interested (Warm),02/05/2026,18,-4,Interested (Warm),Send pricing,Kyle Buzbee,TRUE,Phone,FALSE,None
LID-00124,CID-SRT101,Srt Auto Center,01/22/2026,"Is very interested, but he has to wait until the estate sales process so he said it could be another month ot two before he is able to find anything out,but said that I would be the first person that he calls",Interested (Warm),Nurture,Interested (Warm),02/05/2026,18,-4,Interested (Warm),Send pricing,Kyle Buzbee,TRUE,Visit,FALSE,None
LID-00118,CID-RUS102,Rusk County Op,01/22/2026,"Spoke to Matt who said that they switched because a local guy who has about a dozen roll-off containers approached them and said that he would split the money made from the metal 50/50 with them. Matt does not even know the prices the local guy is getting for the metal and has not even seen a single ticket from us or the local guy. He said it has currently been working out great, but it has been for a very short period of time so he cannot say it will continue to work out. He asked me to send him an email @ matt@rcelectric.org with our prices and after the storm, will get with his team and look it over and get back with me.",Follow-Up,Nurture,Interested (Warm),02/05/2026,18,-4,Follow-Up,General follow,Kyle Buzbee,TRUE,Phone,FALSE,None
LID-00119,CID-DEA103,Dealers Collision,01/22/2026,Spoke to the front desk guy and he said he was going to get the with manager who I initially met with and said he would me give a call back.,Interested (Warm),Nurture,Interested (Warm),02/05/2026,18,-4,Interested (Warm),Send pricing,Kyle Buzbee,TRUE,Visit,FALSE,None
LID-00120,CID-ACC,Access 2 Mobility,01/22/2026,"Left a voicemail since the manager was with a customer, but I am going to try and call back a little later if I don’t hear anything.",Interested (Warm),Nurture,Interested (Warm),02/05/2026,18,-4,Interested (Warm),Send pricing,Kyle Buzbee,FALSE,Visit,FALSE,None
LID-00122,CID-DGI102,Dgi,01/22/2026,"Spoke to the owner and he is wanting me to send him prices for 5052 aluminum because he currently takes it to Dallas. He generates about 2,000 pounds of aluminum every 6-8 weeks.",Interested (Warm),Nurture,Interested (Warm),02/05/2026,18,-4,Interested (Warm),Send pricing,Kyle Buzbee,TRUE,Phone,FALSE,None
LID-00124,CID-SRT101,Srt Auto Center,01/22/2026,"Is very interested, but he has to wait until the estate sales process so he said it could be another month ot two before he is able to find anything out,but said that I would be the first person that he calls",Interested (Warm),Nurture,Interested (Warm),02/05/2026,18,-4,Interested (Warm),Send pricing,Kyle Buzbee,TRUE,Visit,FALSE,None
LID-00128,CID-CIT104,City of Troup Pulic Works,01/21/2026,Called the city of Troup public works and she said that they typically have enough to justify taking it to a scrap yard about every 2-3 years so they are disqualified.,Disqualified,Lost,Disqualified,01/21/2026,19,-19,Disqualified,Check periodic,Kyle Buzbee,FALSE,Visit,FALSE,None
LID-00129,CID-TRO108,Troup ISD Transportation,01/21/2026,"Called because they handle the repairs and maintenance on all of the public school busses, but they didn't answer so I left a voicemail.",No Answer,Outreach,Cold,01/24/2026,19,-16,No Answer,Try again,Kyle Buzbee,FALSE,Visit,FALSE,None
LID-00133,CID-RED108,Reds Auto Parts,01/21/2026,his shop is right next to Troup auto service and he probably has at least 50+ old model cars sitting there. I knocked on their office door and no answer so I called him and left a voicemail. I will call back tomorrow earlier in the day and see if he is interested in a roll off container or possibly getting the car crushing crew out there,No Answer,Outreach,Cold,01/24/2026,19,-16,No Answer,Try again,Kyle Buzbee,FALSE,Visit,FALSE,None
LID-00135,CID-JAM104,James Awning and Canopy,01/21/2026,I have been by there several times and cannot seem to get ahold of him to try and buy his aluminum. I need to keep following up.,No Answer,Outreach,Cold,01/24/2026,19,-16,No Answer,Try again,Kyle Buzbee,FALSE,Visit,FALSE,None
LID-00136,CID-JAC106,Jacksonville Awning,01/21/2026,He has the same type of company as James Awning and he ended up taking his aluminum scrap to the K&L Jacksonville location and was very happy with the price he got and how he was treated.,Disqualified,Lost,Disqualified,01/21/2026,19,-19,Disqualified,Check periodic,Kyle Buzbee,FALSE,Visit,FALSE,None
LID-00137,CID-SAN103,Sanders Welding Service,01/21/2026,"Does not generate enough scrap to warrant a roll off container. Maybe takes it every once in a while, but very infrequently.",Disqualified,Lost,Disqualified,01/21/2026,19,-19,Disqualified,Check periodic,Kyle Buzbee,FALSE,Visit,FALSE,None
LID-00138,CID-BOZ101,Bozard Fabrication,01/21/2026,Not enough scrap metal,Disqualified,Lost,Disqualified,01/21/2026,19,-19,Disqualified,Check periodic,Kyle Buzbee,FALSE,Visit,FALSE,None
LID-00139,CID-MRR102,Mr Roachie Welding,01/21/2026,No scrap metal,Disqualified,Lost,Disqualified,01/21/2026,19,-19,Disqualified,Check periodic,Kyle Buzbee,FALSE,Visit,FALSE,None
LID-00140,CID-CLE108,Clear Path Service,01/21/2026,No answer,No Answer,Outreach,Cold,01/24/2026,19,-16,No Answer,Try again,Kyle Buzbee,FALSE,Visit,FALSE,None
LID-00141,CID-HBB101,Hb Building Supplies,01/21/2026,"No scrap, but they sell scrap metal and have businesses getting supplies so I left her several of my cards and told her to hand them out and let people know that I will buy their metal.,",Disqualified,Lost,Disqualified,01/21/2026,19,-19,Disqualified,Check periodic,Kyle Buzbee,FALSE,Visit,FALSE,None
LID-00142,CID-LAR106,Larios Remodeling Painting,01/21/2026,The owner said that he doesn’t have very much scrap and that he was not interested,Disqualified,Lost,Disqualified,01/21/2026,19,-19,Disqualified,Check periodic,Kyle Buzbee,FALSE,Visit,FALSE,None
LID-00143,CID-STE149,Steele Feed and Seed,01/21/2026,Does not deal with very much scrap metal,Disqualified,Lost,Disqualified,01/21/2026,19,-19,Disqualified,Check periodic,Kyle Buzbee,FALSE,Visit,FALSE,None
LID-00125,CID-CR105,C R,01/21/2026,"Spoke with the receptionist and she took down my information and would pass it along to the owner. They currently do all of the processing for their scrap metal in house so are not particuarly concerned about a roll off, but I told her that I would love to work with them and buy their scrap from them and can offer premium pricing. She is passing the info to the owners, and I should hear something back soon.",Interested (Warm),Nurture,Interested (Warm),02/04/2026,19,-5,Interested (Warm),Send pricing,Kyle Buzbee,FALSE,Visit,FALSE,None
LID-00126,CID-THE111,The Mink Plumbing,01/21/2026,They currently throw their scrap metal in the dumpster so I told them I would pay them for their scrap. The receptionist took down my information and said she would pass it on up to the owners.,Interested (Warm),Nurture,Interested (Warm),02/04/2026,19,-5,Interested (Warm),Send pricing,Kyle Buzbee,TRUE,Visit,FALSE,None
LID-00127,CID-NEC101,Neckover Trailers,01/21/2026,"Talked to the manager and he said that us and Falcon pay about the same for our scrap and I asked what it would take for us to get two containers out there for them and he said that if Mark would visit more often we would have already had it. He said price really isn't the issue, it has just been the way they have handled it for a while and haven't really thought much about it. Told him how much easier it would be to just have 1 company handling all of their metal and he said he would look into it and get back to me.",Interested (Warm),Nurture,Interested (Warm),02/04/2026,19,-5,Interested (Warm),Send pricing,Kyle Buzbee,TRUE,Visit,FALSE,None
LID-00130,CID-WAG102,Waggener Electric,01/21/2026,"Spoke to the owner of Waggener who said he has roughly 12,000 pounds of ICW #1 & #2 and hasn't sold any copper since the Chinese olympics. He is sitting on it because he has a wire splitter, but just hasnt had the time to go through it and do it. I texted him my contact information and he lives in Henderson so I could maybe make an offer he would have a hard time refusing.",Initial Contact,Outreach,Interested (Warm),02/20/2026,19,11,Initial Contact,General follow,Kyle Buzbee,TRUE,Visit,FALSE,None
LID-00132,CID-AUT166,Auto Express,01/21/2026,"Spoke to the manager who said that they currently seperate it all and typically take it to AIM or Tyler Iron. I suggested the roll off container and he was very interested and said it would resolve a lot of the owners headaches in having to deal with it. I am sending them an email with our current prices. I do not know how much they generate, but they typically produce mainly aluminum breakage, cast iron, and tin.",Interested (Warm),Nurture,Interested (Warm),02/04/2026,19,-5,Interested (Warm),Send pricing,Kyle Buzbee,TRUE,Visit,FALSE,None
LID-00134,CID-TRO109,Troup Auto Service and Towing,01/21/2026,"Jason was not in and he is the one to talk to so I need to visit them again sometime soon, they currently use someone but aren't sure who it is. She told me that she would pass it along to him and let me know.",Follow-Up,Nurture,Interested (Warm),02/04/2026,19,-5,Follow-Up,General follow,Kyle Buzbee,TRUE,Visit,FALSE,None
LID-00125,CID-CR105,C R,01/21/2026,"Spoke with the receptionist and she took down my information and would pass it along to the owner. They currently do all of the processing for their scrap metal in house so are not particuarly concerned about a roll off, but I told her that I would love to work with them and buy their scrap from them and can offer premium pricing. She is passing the info to the owners, and I should hear something back soon.",Interested (Warm),Nurture,Interested (Warm),02/04/2026,19,-5,Interested (Warm),Send pricing,Kyle Buzbee,FALSE,Visit,FALSE,None
LID-00126,CID-THE111,The Mink Plumbing,01/21/2026,They currently throw their scrap metal in the dumpster so I told them I would pay them for their scrap. The receptionist took down my information and said she would pass it on up to the owners.,Interested (Warm),Nurture,Interested (Warm),02/04/2026,19,-5,Interested (Warm),Send pricing,Kyle Buzbee,TRUE,Visit,FALSE,None
LID-00127,CID-NEC101,Neckover Trailers,01/21/2026,"Talked to the manager and he said that us and Falcon pay about the same for our scrap and I asked what it would take for us to get two containers out there for them and he said that if Mark would visit more often we would have already had it. He said price really isn't the issue, it has just been the way they have handled it for a while and haven't really thought much about it. Told him how much easier it would be to just have 1 company handling all of their metal and he said he would look into it and get back to me.",Interested (Warm),Nurture,Interested (Warm),02/04/2026,19,-5,Interested (Warm),Send pricing,Kyle Buzbee,TRUE,Visit,FALSE,None
LID-00130,CID-WAG102,Waggener Electric,01/21/2026,"Spoke to the owner of Waggener who said he has roughly 12,000 pounds of ICW #1 & #2 and hasn't sold any copper since the Chinese olympics. He is sitting on it because he has a wire splitter, but just hasnt had the time to go through it and do it. I texted him my contact information and he lives in Henderson so I could maybe make an offer he would have a hard time refusing.",Initial Contact,Outreach,Interested (Warm),02/20/2026,19,11,Initial Contact,General follow,Kyle Buzbee,TRUE,Visit,FALSE,None
LID-00132,CID-AUT166,Auto Express,01/21/2026,"Spoke to the manager who said that they currently seperate it all and typically take it to AIM or Tyler Iron. I suggested the roll off container and he was very interested and said it would resolve a lot of the owners headaches in having to deal with it. I am sending them an email with our current prices. I do not know how much they generate, but they typically produce mainly aluminum breakage, cast iron, and tin.",Interested (Warm),Nurture,Interested (Warm),02/04/2026,19,-5,Interested (Warm),Send pricing,Kyle Buzbee,TRUE,Visit,FALSE,None
LID-00134,CID-TRO109,Troup Auto Service and Towing,01/21/2026,"Jason was not in and he is the one to talk to so I need to visit them again sometime soon, they currently use someone but aren't sure who it is. She told me that she would pass it along to him and let me know.",Follow-Up,Nurture,Interested (Warm),02/04/2026,19,-5,Follow-Up,General follow,Kyle Buzbee,TRUE,Visit,FALSE,None
LID-00144,CID-FAL101,Falcon Trailers,01/20/2026,Won the account,Interested (Warm),Nurture,Interested (Warm),01/21/2026,20,-19,Account Won,Onboard Account,Kyle Buzbee,TRUE,Phone,FALSE,None
LID-00144,CID-FAL101,Falcon Trailers,01/20/2026,Won the account,Interested (Warm),Nurture,Interested (Warm),01/21/2026,20,-19,Account Won,Onboard Account,Kyle Buzbee,TRUE,Phone,FALSE,None
LID-00149,CID-ADE106,Adept Gutters,01/19/2026,"No answer but left voicemail telling him about who I was, our services, and letting him know that we can offer maximum value for his scrap metal",No Answer,Outreach,Cold,01/22/2026,21,-18,No Answer,Try again,Kyle Buzbee,FALSE,Phone,FALSE,None
LID-00154,CID-ADE106,Adept Gutters,01/19/2026,"No answer but left voicemail about who we are, our services, and how we can get him more money for his metal.",No Answer,Outreach,Cold,01/22/2026,21,-18,No Answer,Try again,Kyle Buzbee,FALSE,Phone,FALSE,None
LID-00157,CID-BAN102,Bankston Gutter,01/19/2026,No answer but left voicemail explaining how our services could help bring,No Answer,Outreach,Cold,01/22/2026,21,-18,No Answer,Try again,Kyle Buzbee,FALSE,Phone,FALSE,None
LID-00145,CID-ATS101,Ats Outdoor,01/19/2026,"Called asking if the owner had gotten back from his vacation, and he told me to go ahead and bring the roll off as soon as possible. They are going to want cash because the money they make from the roll-off, similar to John Deere, will be allocated to employee lunches and various other things.",Account Won,Won,Active,01/20/2026,21,-20,Account Won,Onboard Account,Kyle Buzbee,TRUE,Phone,FALSE,None
LID-00146,CID-TYL133,Tyler Steel,01/19/2026,"Sent Johnathan an email regarding pricing because last week he told me to send him one and he would go over it with his partners. Quoted him at $9.00 per 100 lbs for short iron and $7.00 per 100 lbs for long iron and tin, but these prices are flexible dependent on the frequency and volume of their container turnaround. I also mentioned that prices are subject to change based on the market and that we would love to earn his business, and if our prices aren't as competitive as he would like, then we could discuss it.",Follow-Up,Nurture,Interested (Warm),02/02/2026,21,-7,Follow-Up,General follow,Kyle Buzbee,TRUE,Email,FALSE,None
LID-00147,CID-LON104,Lone Star Exteriors,01/19/2026,"Called and did not get an answer, but I left a voicemal explaining our services and how we can help his company get the most out of their scrap metal",Initial Contact,Outreach,Interested (Warm),02/18/2026,21,9,Initial Contact,General follow,Kyle Buzbee,TRUE,Phone,FALSE,None
LID-00148,CID-FAL101,Falcon Trailers,01/19/2026,"Spoke to the owner, and they are currently using AIM. He said that they typically dump a 30-yard trailer of short iron once a month and said to call him around 11:00 tomorrow morning, and we can go over his ticket from AIM and see if we can't work out a better/more competitive price.",Interested (Warm),Nurture,Interested (Warm),02/02/2026,21,-7,Interested (Warm),Send pricing,Kyle Buzbee,TRUE,Phone,FALSE,None
LID-00150,CID-HUN102,Hung Right Seamless Gutters,01/19/2026,"Mainly aluminium and some tin. Said he will start bringing his gutters to Madfos, he cant have a roll off because he runs the business out of his house and they dont allow it. He brings in a couple hundred pounds a week",Initial Contact,Outreach,Interested (Warm),02/18/2026,21,9,Initial Contact,General follow,Kyle Buzbee,TRUE,Visit,FALSE,None
LID-00151,CID-CYC107,Cyclops Gutter Service,01/19/2026,"Has had bad experiences with K&L (Mineola) regarding weight/screws. Goes to Tyler Iron. Residential location, no roll-off. Asked for info. Madfos might be the key.",Interested (Warm),Nurture,Interested (Warm),02/02/2026,21,-7,Interested (Warm),Send pricing,Kyle Buzbee,TRUE,Visit,FALSE,None
LID-00152,CID-GUT109,Gutterworks Gutter Cleaning Service,01/19/2026,Called and spoke to the owner who said that they do not have enough scrap metal to warrant a a roll off.,Initial Contact,Outreach,Interested (Warm),02/18/2026,21,9,Initial Contact,General follow,Kyle Buzbee,TRUE,Visit,FALSE,None
LID-00153,CID-PRE115,Premier Seamless Gutters,01/19/2026,"Very interested in services, wants info via text. Will let me know.",Interested (Warm),Nurture,Interested (Warm),02/02/2026,21,-7,Interested (Warm),Send pricing,Kyle Buzbee,TRUE,Phone,FALSE,None
LID-00155,CID-ADO101,Adonis Gutter Solutions,01/19/2026,"Lives in Mineola, interested in roll off but manager makes him take screws out. Takes to Tyler Iron.",Interested (Warm),Nurture,Interested (Warm),02/02/2026,21,-7,Interested (Warm),Send pricing,Kyle Buzbee,TRUE,Visit,FALSE,None
LID-00156,CID-WRI103,Wright Gutter,01/19/2026,Said he would think about it and call back. Has roughly 800 lbs a month.,Interested (Warm),Nurture,Interested (Warm),02/02/2026,21,-7,Interested (Warm),Send pricing,Kyle Buzbee,TRUE,Phone,FALSE,None
LID-00158,CID-EAS108,East Texas Gutter Systems,01/19/2026,"No scrap currently, but needs to take a load soon (every 2 months). Planning on stopping by. Texted Erick pricing.",Interested (Warm),Nurture,Interested (Warm),02/02/2026,21,-7,Interested (Warm),Send pricing,Kyle Buzbee,TRUE,Phone,FALSE,None
LID-00159,CID-ALL112,All Gutter Companies,01/19/2026,"Sent a text to each gutter company that I had reached out today today explaining our roll-off service and how simple and easy it is. I am waiting to hear back replies, but most gutter companies are family owned so there is good potential there",Interested (Warm),Nurture,Interested (Warm),02/02/2026,21,-7,Interested (Warm),Send pricing,Kyle Buzbee,TRUE,Phone,FALSE,None
LID-00146,CID-TYL133,Tyler Steel,01/19/2026,"Sent Johnathan an email regarding pricing because last week he told me to send him one and he would go over it with his partners. Quoted him at $9.00 per 100 lbs for short iron and $7.00 per 100 lbs for long iron and tin, but these prices are flexible dependent on the frequency and volume of their container turnaround. I also mentioned that prices are subject to change based on the market and that we would love to earn his business, and if our prices aren't as competitive as he would like, then we could discuss it.",Follow-Up,Nurture,Interested (Warm),02/02/2026,21,-7,Follow-Up,General follow,Kyle Buzbee,TRUE,Email,FALSE,None
LID-00147,CID-LON104,Lone Star Exteriors,01/19/2026,"Called and did not get an answer, but I left a voicemal explaining our services and how we can help his company get the most out of their scrap metal",Initial Contact,Outreach,Interested (Warm),02/18/2026,21,9,Initial Contact,General follow,Kyle Buzbee,TRUE,Phone,FALSE,None
